id,illness,symptom,belong
356,冷经伤气嘶哑,"声音嘶哑，消瘦无力,",冷经冷病
357,眼胞肿痛,遇风流泪加重，红肿，,热经热病
358,热经咽炎（los lik ghongd洛宁宫）,咽红，肿大，发烧，,热经热病
359,冷经咽炎（mik mongb lik ghongd迷蒙宁宫）,"咽痛咳嗽，痰清色白,",冷经冷病
360,冷病肾虚腰腿疼痛,"腰腿疼痛，面色苍白，手脚冷,",冷经冷病
361,冷病水湿腰腿疼痛,腰腿冷痛，遇冷加重,冷经冷病
362,热病气血阻滞腰腿疼痛,"腰腿刺痛，口苦，解黑色便,",热经热病
363,热病湿热腰腿痛,腰腿痛处发热，口苦，尿黄，,热经热病
364,热经喉痛,"发烧，喉咙肿痛,",热经热病
365,冷经喉痛,喉痛，咳嗽，无痰，,冷经冷病
366,疔疮,本症初期、化脓期、恢复期全程均,热经热病
367,冷经腰痛,"冷痛，得热痛减,",冷经冷病
368,热经腰痛,痛处发热、尿黄，,热经热病
369,热经水毒口疮病,发烧，口腔溃烂,热经热病
370,热经湿热口疮病,发烧，口腔溃烂，,热经热病
371,冷病赖洛连江岗（冷病复发性口腔炎）,"口腔溃烂，不红不肿,",冷经冷病
372,热病赖洛连江岗（热病复发性口腔炎）,口腔溃烂，红肿，辣痛，,热经热病
373,舌开裂,口干，舌燥，,热经热病
374,牙痛,"剧烈疼痛,发烧,",热经热病
375,丹毒,皮肤出现疹子，发热，疼痛，,热经热病
376,眼边溃烂,"流泪，红肿,",冷热并病
377,湿热黄水疮,起黄色水泡、身热，,热经热病
378,冷病气虚血虚黄水疮,脓泡稀疏，色淡，,冷经冷病
379,粉刺,"本症为小疾,",冷热并病
380,牛皮癣,,冷热并病
381,眼生挑针,红肿，疼痛，,热经热病
382,风毒白眼珠肿痛,白眼珠疼痛，充血，,热经热病
383,热毒白眼珠肿痛,发热、眼红、疼痛，,热经热病
